Registration Group,Support Item ID,Support Item,Variant Description,Variant ID,Support Item Description,Unit of Measure,Quote,Price,Price Control,Support Categories,Support Category Number
Assist Prod-Pers Care/Safety,350,Bed adaptation,beds - extra width or height power adjust,05_181210200_0103_1_2,beds - extra width or height power adjust,Each,Y,,N,Assistive technology,5
Assist Prod-Pers Care/Safety,350,Bed adaptation,beds - hi lo with companion bed,05_181210201_0103_1_2,"hi-lo bed with second detachable bed for partner, detachment is to assist with care needs",Each,Y,,N,Assistive technology,5
Assist Prod-Pers Care/Safety,350,Bed adaptation,bed blocks,05_181212202_0103_1_2,bed blocks,Each,N,,N,Assistive technology,5
Assist Prod-Pers Care/Safety,350,Bed adaptation,bed cradle- adjustable height,05_181221203_0103_1_2,bed cradle- adjustable height,Each,N,,N,Assistive technology,5
Assist Prod-Pers Care/Safety,350,Bed adaptation,sleep system,05_181224204_0103_1_2,Positioning cushions to help a participant maintain a consistent and optimal position while sleeping or resting.,Each,Y,,N,Assistive technology,5
Assist Prod-Pers Care/Safety,350,Bed adaptation,bed rails covers,05_181227206_0103_1_2,bed rails covers,Each,N,,N,Assistive technology,5
Assist Prod-Pers Care/Safety,350,Bed adaptation,bed rails,05_181227207_0103_1_2,Rails which attach to a bed to prevent the participant falling out. Price guidance is for one bed rail.,Each,N,,N,Assistive technology,5
Assist Prod-Pers Care/Safety,350,Bed adaptation,beds - extensions,05_181233208_0103_1_2,beds - extensions,Each,N,,N,Assistive technology,5
Assist Prod-Pers Care/Safety,350,Bed adaptation,bed wedges (positioning),05_181288205_0103_1_2,bed wedges (positioning),Each,N,,N,Assistive technology,5
Assist Prod-Pers Care/Safety,360,Adapted furniture,adapted furniture - other,05_188800051_0103_1_2,"includes therapy cushions, conductive education furniture, hand grips mounted on furniture etc",Each,N,,N,Assistive technology,5
Assist Prod-Pers Care/Safety,370,Bathing and toileting equipment repair,bathing and toileting equipment repair,05_500933306_0103_1_2,repairs to any toileting and bathing equipment,Each,N,,N,Assistive technology,5
Assist Prod-Pers Care/Safety,380,Powered bed and associated repairs,electric bed repair,05_501812311_0103_1_2,electric bed repair,Each,N,,N,Assistive technology,5
Assist Prod-Pers Care/Safety,390,Bathing and toileting equipment delivery,"toilet and bathroom equipment delivery, set up/ training",05_700912325_0103_1_2,"Equipment delivery, removal from wrapping, fitting/adjusting for participant's disability specific needs and or training.",Hour,N,,N,Assistive technology,5
Assist Prod-Pers Care/Safety,400,Seating/standing equipment delivery and setup,seating/standing equipment delivery and setup,05_701809328_0103_1_2,"Equipment delivery, removal from wrapping, fitting/adjusting for participant's disability specific needs and or training.",Each,N,,N,Assistive technology,5
Assist Prod-Pers Care/Safety,400,Seating/standing equipment delivery and setup,"seating/standing frame equipment delivery, set up/ training",05_701809338_0103_1_2,"equipment delivery, removal from wrapping ready, fitting/adjusting for participant and or training.",Each,N,,N,Assistive technology,5
Assist Prod-Pers Care/Safety,410,Bed and mattress equipment delivery and setup,"bed/ mattress equipment delivery, set up/ training",05_701812329_0103_1_2,"Equipment delivery, removal from wrapping, fitting/adjusting for the participant's disability specific needs and/or training in usage.",Each,N,,N,Assistive technology,5
Assist Prod-Pers Care/Safety,420,Toilet and bathroom equipment delivery and setup,toilet and bathroom equipment delivery,05_710912335_0103_1_2,equipment delivery and removal from wrapping ready for use,Each,N,,N,Assistive technology,5
Assist Prod-Pers Care/Safety,410,Bed and mattress equipment delivery and setup,bed/ mattress equipment delivery to a participant,05_711812339_0103_1_2,equipment delivery and removal from wrapping ready for use,Each,N,,N,Assistive technology,5
Assist Prod-Pers Care/Safety,420,Toilet and bathroom equipment delivery and setup,toilet and bathroom equipment rental,05_800912344_0103_1_2,short term rental or hire of bathroom or toilet equipment,Each,N,,N,Assistive technology,5
Assist Prod-Pers Care/Safety,430,Bed and mattress equipment rental,bed and mattress rental,05_801812347_0103_1_2,weekly rate,Each,N,,N,Assistive technology,5
Assist Prod-Pers Care/Safety,440,Portable ramp,ramp portable fibre glass 1200mm,06_183015389_0103_2_2,portable ramp suitable for outings etc but not permanently affixed,Each,N,,N,Home modifications,6
Assist Prod-Pers Care/Safety,440,Portable ramp,ramp portable fibre glass 1650mm,06_183015390_0103_2_2,portable ramp suitable for outings etc but not permanently affixed,Each,N,,N,Home modifications,6
Assist Prod-Pers Care/Safety,440,Portable ramp,ramp portable fibre glass 1350mm,06_183015391_0103_2_2,portable ramp suitable for outings etc but not permanently affixed,Each,N,,N,Home modifications,6
Assist Prod-Pers Care/Safety,440,Portable ramp,ramp portable fibre glass 2000mm,06_183015392_0103_2_2,portable ramp suitable for outings etc but not permanently affixed,Each,Y,,N,Home modifications,6
Assist Prod-Pers Care/Safety,440,Portable ramp,ramp portable fibre glass 2000mm with edge,06_183015393_0103_2_2,portable ramp suitable for outings etc but not permanently affixed,Each,Y,,N,Home modifications,6
Assist Prod-Pers Care/Safety,440,Portable ramp,ramp portable fibre glass 875mm,06_183015394_0103_2_2,portable ramp suitable for outings etc but not permanently affixed,Each,N,,N,Home modifications,6
Assist Prod-Pers Care/Safety,440,Portable ramp,ramp portable fibre glass 700mm,06_183015395_0103_2_2,portable ramp suitable for outings etc but not permanently affixed,Each,N,,N,Home modifications,6
"Assist-Life Stage, Transition",450,Support coordination assistance,support connection,07_001_0106_8_3,"Assistance to strengthen participant's abilities to coordinate supports & participate in the community. This includes resolving points of crisis, developing capacity & resilience in a participant's network & coordinating supports from a range of sources.",Hour,N,"56,61",Y,Coordination of Supports,7
"Assist-Life Stage, Transition",450,Support coordination assistance,coordination of supports,07_002_0106_8_3,"Further qualifications/experience required to strengthen a higher needs participant's ability to coordinate their supports & participate in the community. This may include resolving points of crisis, & developing resilience in the participant's network.",Hour,N,"92,27",Y,Coordination of Supports,7
"Assist-Life Stage, Transition",460,Accommodation planning assistance,assistance with accommodation and tenancy obligations,08_005_0106_2_3,"Support is provided to guide, prompt, or undertake activities to ensure the participant obtains/retains appropriate accommodation. May include assisting to apply for a rental tenancy or to undertake tenancy obligations.",Hour,N,"56,61",Y,Improved living arrangements,8
"Assist-Life Stage, Transition",470,Life transition planning and mentoring,"Life transition planning incl mentoring, peer support and indiv skill devt.",09_006_0106_6_3,"Establishing volunteer assistance within the participant's home or community to develop skills. For instance, assistance in attending appointments, shopping, bill paying, taking part in social activities and maintaining contact with others.",Hour,N,"56,61",Y,Increased social and community participation,9
"Assist-Life Stage, Transition",480,Support planning assistance,"assistance with decision making, daily planning, budgeting",15_035_0106_1_3,"Provision of time limited support to assist a person to develop and maintain daily budget, including assisting in planning purchases.",Hour,N,"42,79",Y,Improved daily living skills,15
Assist-Travel/Transport,490,Specialised transport,specialised transport to school/educational facility/employment/community,02_050_0108_1_1,Transport required to get a person with disability to school/educational facility/employment/community when they are unable to travel by other means due to their disability,Day,Y,,N,Transport (auto payments),2
Assist-Travel/Transport,490,Specialised transport,transport,02_051_0108_1_1,transport,Annual,Y,,N,Transport (auto payments),2
Assist-Travel/Transport,500,Adapted vehicle rental,rental of adapted vehicle,05_353_0108_1_2,rental of adapted vehicle,Each,Y,,N,Assistive technology,5
Assistive Equip-Recreation,510,Prostheses,adaptions for arm and hand prosthetics for sport and leisure,05_061826297_0112_1_2,terminal device to enable participation in sport,Each,N,,N,Assistive technology,5
Assistive Equip-Recreation,520,Cycles,hand-propelled bicycles,05_121805101_0112_1_2,hand-propelled bicycles,Each,Y,,N,Assistive technology,5
Assistive Equip-Recreation,520,Cycles,specialist tricycles or quadricycle - foot propelled,05_121806409_0112_1_2,specialist tricycles or quadricycle - foot propelled,Each,Y,,N,Assistive technology,5
Assistive Equip-Recreation,520,Cycles,specialist tricycles or quadricycle - hand propelled,05_121809102_0112_1_2,specialist tricycles or quadricycle - hand propelled,Each,Y,,N,Assistive technology,5
Assistive Equip-Recreation,520,Cycles,disability specific cycle adaptions,05_121821103_0112_1_2,disability specific cycle adaptions,Each,Y,,N,Assistive technology,5
Assistive Equip-Recreation,530,"Wheelchair, specialised recreational",wheelchair - track racing,05_122203291_0112_1_2,wheelchair - track racing,Each,Y,,N,Assistive technology,5
Assistive Equip-Recreation,530,"Wheelchair, specialised recreational",wheelchair - beach/sand capable - push,05_122218293_0112_1_2,wheelchair - beach/sand capable - push,Each,Y,,N,Assistive technology,5
Assistive Equip-Recreation,540,Adapted books,adapted books,05_223088289_0112_1_2,books adapted with switches or other adaptions to enable a child or young person with disability to use them.,Each,N,,N,Assistive technology,5
Assistive Equip-Recreation,550,"Toys, specialised",switch adapted toys,05_300303288_0112_1_2,Toys adapted with switches or other adaptions to enable a child or young person with disability to use them.,Each,N,,N,Assistive technology,5
Assistive Equip-Recreation,550,"Toys, specialised",other toy adaptions,05_300303290_0112_1_2,other toy adaptions,Each,N,,N,Assistive technology,5
Assistive Equip-Recreation,550,"Toys, specialised",adapted mobility toy,05_300303302_0112_1_2,adapted mobility toy,Each,N,,N,Assistive technology,5
Assistive Equip-Recreation,550,"Toys, specialised",assistive products for audio visual gaming,05_300309296_0112_1_2,Interfaces that allow a person with disability to access recreational gaming equipment when unable to do so through conventional routes,Each,Y,,N,Assistive technology,5
Assistive Equip-Recreation,530,"Wheelchair, specialised recreational",sport adaptions to wheelchair (power or manual),05_300900292_0112_1_2,sport adaptions to wheelchair (power or manual),Each,N,,N,Assistive technology,5
Assistive Equip-Recreation,530,"Wheelchair, specialised recreational",basketball wheelchair,05_300903294_0112_1_2,basketball wheelchair,Each,Y,,N,Assistive technology,5
Assistive Equip-Recreation,530,"Wheelchair, specialised recreational",rugby wheelchair,05_300903295_0112_1_2,rugby wheelchair,Each,Y,,N,Assistive technology,5
Assistive Equip-Recreation,560,Specialised recreation equipment,specialised bowling equipment,05_300912300_0112_1_2,specialised bowling equipment,Each,N,,N,Assistive technology,5
Assistive Equip-Recreation,560,Specialised recreation equipment,adapted recreation equipment - other,05_308800285_0112_1_2,"Products such as card holders, camera holders and adaptions to enable a person with disability to participate in recreational activity",Each,Y,,N,Assistive technology,5
Assistive Equip-Recreation,560,Specialised recreation equipment,specialised recreation equipment repairs,05_503000316_0112_1_2,specialised recreation equipment repairs,Each,N,,N,Assistive technology,5
Assistive Equip-Recreation,560,Specialised recreation equipment,"recreation equipment delivery, set up/ training",05_703000332_0112_1_2,"Equipment delivery, removal from wrapping, set up adjustment and training for the participant's disability specific needs.",Each,N,,N,Assistive technology,5
Assistive Equip-Recreation,560,Specialised recreation equipment,recreation equipment delivery to a participant,05_713000342_0112_1_2,equipment delivery and removal from wrapping ready for use,Each,N,,N,Assistive technology,5
Assistive Equip-Recreation,560,Specialised recreation equipment,recreation equipment rental,05_803000349_0112_1_2,recreation equipment rental,Each,N,,N,Assistive technology,5
Assistive Prod-Household Task,570,Household automation tools,one or more assistive devices to assist with dishwashing,05_150600320_0123_1_2,"Adapted dish cloths, utensils, detergent dispensers etc.",Each,N,,N,Assistive technology,5
Assistive Prod-Household Task,570,Household automation tools,other assistive equipment for household tasks,05_158800321_0123_1_2,Equipment specially selected due to the persons disability that enables them to perform household tasks like cleaning or maintenance,Each,N,,N,Assistive technology,5
Assistive Prod-Household Task,570,Household automation tools,other alarms and door bells,05_222704219_0123_1_2,"Amplified, visual alert and/or vibratory alarms",Each,N,,N,Assistive technology,5
Assistive Prod-Household Task,570,Household automation tools,adapted clocks,05_222712259_0123_1_2,adapted clocks,Each,N,,N,Assistive technology,5
Assistive Prod-Household Task,570,Household automation tools,programmable memory aids,05_222716260_0123_1_2,programmable memory aids,Each,N,,N,Assistive technology,5
Assistive Prod-Household Task,580,Environmental control system,environmental control systems,05_241303281_0123_1_2,environmental control systems,Each,Y,,N,Assistive technology,5
Assistive Prod-Household Task,570,Household automation tools,ECU controlled wireless mains socket,05_241303282_0123_1_2,ECU controlled wireless mains socket,Each,N,,N,Assistive technology,5
Assistive Prod-Household Task,580,Environmental control system,environmental control software,05_241306283_0123_1_2,environmental control software,Each,Y,,N,Assistive technology,5
Assistive Prod-Household Task,590,Household automation equipment delivery & setup,"ECU equipment delivery, set up/ training",05_702413331_0123_1_2,"Equipment delivery, removal from wrapping, fitting/adjusting for participant disability specific needs and/ or training.",Each,N,,N,Assistive technology,5
Assistive Prod-Household Task,590,Household automation equipment delivery & setup,ECU equipment delivery to a participant,05_712413341_0123_1_2,equipment delivery and removal from wrapping ready for use,Each,N,,N,Assistive technology,5
Assistive Prod-Household Task,580,Environmental control system,ECU rental,05_802413323_0123_1_2,ECU rental,Each,N,,N,Assistive technology,5
Behaviour Support,600,Specialist behavioural intervention support,Specialist behavioural intervention support,11_022_0110_7_3,"Highly specialised intensive support interventions to address significantly harmful or persistent behaviours of concern. Development of behaviour support plans that temporarily use restrictive practices, with  intention to minimise use of these practices.",Hour,N,"192,71",Y,Improved relationships,11
Behaviour Support,600,Specialist behavioural intervention support,"behaviour management plan, training in behaviour management strategies",11_023_0110_7_3,Training for carers and others in behaviour management strategies required due the persons disability.,Hour,N,"175,57",Y,Improved relationships,11
Comms & Info Equipment,610,Voice amplifiers,voice generators,05_220903233_0124_1_2,Device held to neck which picks up vibrations and amplifies as speech.,Each,N,,N,Assistive technology,5
Comms & Info Equipment,610,Voice amplifiers,voice amplifiers for personal use,05_220906234_0124_1_2,Device to amplify voice.,Each,N,,N,Assistive technology,5
Comms & Info Equipment,620,Tablets and software,word processing software,05_221224237_0124_1_2,word processing software,Each,Y,,N,Assistive technology,5
Comms & Info Equipment,610,Voice amplifiers,microphones,05_221833248_0124_1_2,microphones,Each,N,,N,Assistive technology,5
Comms & Info Equipment,630,Communication aid,face-to-face communication assistive products,05_222100249_0124_1_2,"Communication boards accessed by pointing, eye gaze or other selection methods.",Each,N,,N,Assistive technology,5
Comms & Info Equipment,620,Tablets and software,communication software for computer or tablet,05_222102250_0124_1_2,Software to convert a tablet or computer device to a communication device.,Each,N,,N,Assistive technology,5
Comms & Info Equipment,620,Tablets and software,customised commercial tablet,05_222102251_0124_1_2,customised commercial tablet,Each,N,,N,Assistive technology,5
Comms & Info Equipment,640,Keyboard and mouse input devices,letter and symbol sets and boards,05_222103252_0124_1_2,Books or boards with letter symbols or pictures that assist with communication.,Each,N,,N,Assistive technology,5
Comms & Info Equipment,610,Voice amplifiers,communication amplifiers,05_222106253_0124_1_2,device to amplify voice,Each,N,,N,Assistive technology,5
Comms & Info Equipment,650,Speech output devices,static-single button device which provides audible message output,05_222109254_0124_1_2,static-single button device which provides audible message output,Each,N,,N,Assistive technology,5
Comms & Info Equipment,650,Speech output devices,dynamic display dialogue units,05_222109255_0124_1_2,communication device with customisable and changing screens which allows a highly customised voice output generation,Each,Y,,N,Assistive technology,5
Comms & Info Equipment,650,Speech output devices,text to speech device,05_222109256_0124_1_2,Keyed input converting text to speech.,Each,Y,,N,Assistive technology,5
Comms & Info Equipment,660,Telephone input accessories,accessories for telephoning,05_222421257_0124_1_2,e.g. multipurpose big button switch,Each,N,,N,Assistive technology,5
Comms & Info Equipment,650,Speech output devices,personal reader- speech output,05_223003279_0124_1_2,personal reader- speech output,Each,Y,,N,Assistive technology,5
Comms & Info Equipment,650,Speech output devices,personal reader- speech and visual output,05_223030280_0124_1_2,personal reader- speech and visual output,Each,Y,,N,Assistive technology,5
Comms & Info Equipment,640,Keyboard and mouse input devices,keyboards/ key guards,05_223603267_0124_1_2,guards that assist a person in activating the right part of a screen or keyboard,Each,N,,N,Assistive technology,5
Comms & Info Equipment,640,Keyboard and mouse input devices,simple switches,05_223612268_0124_1_2,"Including single input switches, pressure, touch, and puff.",Each,N,,N,Assistive technology,5
Comms & Info Equipment,640,Keyboard and mouse input devices,switch adapted mouse,05_223612269_0124_1_2,Computer mouse adapted for switch access.,Each,N,,N,Assistive technology,5
Comms & Info Equipment,670,Specialised input devices,input software i.e. voice activated software,05_223618270_0124_1_2,Software that allows non-manual or alternate access to a computer.,Each,N,,N,Assistive technology,5
Comms & Info Equipment,670,Specialised input devices,head pointer,05_223621271_0124_1_2,assistive products to position screen pointer and to select items on computer display,Each,Y,,N,Assistive technology,5
Comms & Info Equipment,670,Specialised input devices,eye gaze system,05_223621272_0124_1_2,Hardware and software that directs or selects inputs by gaze to activate a computer or communication device.,Each,Y,,N,Assistive technology,5
Comms & Info Equipment,680,Audible player,static audible player display,05_223907277_0124_1_2,static audible player display,Each,N,,N,Assistive technology,5
Comms & Info Equipment,680,Audible player,portable audible player for computer,05_223907278_0124_1_2,portable audible player for computer,Each,N,,N,Assistive technology,5
Comms & Info Equipment,690,Communication device mounting,fixed position systems - mounting for communication device,05_242403284_0124_1_2,adjustable method of attaching communication device to wheelchair or furniture,Each,N,,N,Assistive technology,5
Comms & Info Equipment,700,Communication device repairs,communication equipment repairs,05_502200312_0124_1_2,communication equipment repairs,Each,N,,N,Assistive technology,5
Community Nursing Care,710,Individual nursing support,individual assessment and support by a Nurse,15_036_0114_1_3,"Provision of care, training and supervision of a delegated worker to respond to the complex care needs of a participant where that care is not the usual responsibility of the Health System.",Hour,N,"93,95",Y,Improved daily living skills,15
Custom Prosthetics,720,Spine and body orthoses,body orthotic - dynamic/lycra,05_060318012_0135_1_2,body orthotic - dynamic/lycra,Each,Y,,N,Assistive technology,5
Custom Prosthetics,730,Hand and arm orthoses,hand splints,05_060606010_0135_1_2,hand splints provided as part of a shorter term therapy program,Each,N,,N,Assistive technology,5
Custom Prosthetics,730,Hand and arm orthoses,"upper limb orthotic - dynamic, lycra",05_060688011_0135_1_2,Lycra or other splints designed to improve functioning.,Each,N,,N,Assistive technology,5
Custom Prosthetics,740,Ankle and foot orthoses,custom foot supports,05_061203014_0135_1_2,Foot supports or restraints for a wheelchair where conventional supports do not suffice.,Each,N,,N,Assistive technology,5
Custom Prosthetics,740,Ankle and foot orthoses,foot orthoses,05_061203015_0135_1_2,foot orthoses,Each,N,,N,Assistive technology,5
Custom Prosthetics,750,Orthopedic shoes,Orthopaedic shoes - other custom made,05_061203041_0135_1_2,Pair of shoes made for a participant who is unable to fit off the shelf or specialist shoes.,Each,Y,,N,Assistive technology,5
Custom Prosthetics,750,Orthopedic shoes,Orthopaedic shoes - to compensate for muscle weakness/activity,05_061203042_0135_1_2,Pair of shoes with extra depth or width that are commercially available,Each,N,,N,Assistive technology,5
Custom Prosthetics,750,Orthopedic shoes,Orthopaedic shoes to add to the length of the leg and foot i.e. shoe raise,05_061203043_0135_1_2,adjustments to regular shoes required due to disability,Each,N,,N,Assistive technology,5
Custom Prosthetics,740,Ankle and foot orthoses,ankle-foot orthoses prefabricated- average price,05_061206016_0135_1_2,ankle-foot orthoses prefabricated- average price,Each,N,,N,Assistive technology,5
Custom Prosthetics,740,Ankle and foot orthoses,ankle-foot orthoses prefabricated sizes 1-4,05_061206017_0135_1_2,ankle-foot orthoses prefabricated sizes 1-4,Each,N,,N,Assistive technology,5
Custom Prosthetics,740,Ankle and foot orthoses,"ankle-foot orthoses prefabricated reg, large, xlge",05_061206018_0135_1_2,"ankle-foot orthoses prefabricated reg, large, xlge",Each,N,,N,Assistive technology,5
Custom Prosthetics,740,Ankle and foot orthoses,ankle-foot orthoses ankle joint,05_061206019_0135_1_2,ankle-foot orthoses ankle joint,Each,Y,,N,Assistive technology,5
Custom Prosthetics,740,Ankle and foot orthoses,ankle-foot orthoses (AFO) static custom made,05_061206020_0135_1_2,ankle-foot orthoses (AFO) static custom made,Each,N,,N,Assistive technology,5
Custom Prosthetics,760,Knee and leg orthoses,knee orthoses,05_061209021_0135_1_2,knee orthoses,Each,N,,N,Assistive technology,5
Custom Prosthetics,760,Knee and leg orthoses,knee-ankle-foot orthoses,05_061212022_0135_1_2,knee-ankle-foot orthoses,Each,Y,,N,Assistive technology,5
Custom Prosthetics,760,Knee and leg orthoses,leg orthoses,05_061213023_0135_1_2,leg orthoses,Each,Y,,N,Assistive technology,5
Custom Prosthetics,770,Hip and thigh orthoses,hip orthoses,05_061215024_0135_1_2,hip orthoses,Each,N,,N,Assistive technology,5
Custom Prosthetics,770,Hip and thigh orthoses,hip-knee orthoses,05_061216025_0135_1_2,hip-knee orthoses,Each,N,,N,Assistive technology,5
Custom Prosthetics,770,Hip and thigh orthoses,thigh orthoses,05_061217026_0135_1_2,thigh orthoses,Each,N,,N,Assistive technology,5
Custom Prosthetics,760,Knee and leg orthoses,lower limb orthotic - dynamic/lycra,05_061218013_0135_1_2,lower limb orthotic - dynamic/lycra,Each,Y,,N,Assistive technology,5
Custom Prosthetics,760,Knee and leg orthoses,hip-knee-ankle-foot orthoses,05_061218027_0135_1_2,hip-knee-ankle-foot orthoses,Each,Y,,N,Assistive technology,5
Custom Prosthetics,720,Spine and body orthoses,thoracolumbar/lumbo-sacral - hip - knee - ankle - foot orthoses,05_061219028_0135_1_2,thoracolumbar/lumbo-sacral - hip - knee - ankle - foot orthoses,Each,Y,,N,Assistive technology,5
Custom Prosthetics,780,Hand and arm prostheses,partial hand prostheses,05_061803029_0135_1_2,partial hand prostheses,Each,Y,,N,Assistive technology,5
Custom Prosthetics,780,Hand and arm prostheses,wrist disarticulation prostheses,05_061806030_0135_1_2,wrist disarticulation prostheses,Each,Y,,N,Assistive technology,5
Custom Prosthetics,780,Hand and arm prostheses,trans-radial prostheses,05_061809031_0135_1_2,trans-radial prostheses,Each,Y,,N,Assistive technology,5
Custom Prosthetics,790,Foot and leg prostheses,trans-humeral prostheses,05_061815032_0135_1_2,trans-humeral prostheses,Each,Y,,N,Assistive technology,5
Custom Prosthetics,790,Foot and leg prostheses,forequarter amputation prostheses,05_061821033_0135_1_2,forequarter amputation prostheses,Each,Y,,N,Assistive technology,5
Custom Prosthetics,790,Foot and leg prostheses,partial foot prostheses,05_062403035_0135_1_2,partial foot prostheses,Each,Y,,N,Assistive technology,5
Custom Prosthetics,790,Foot and leg prostheses,ankle disarticulation prostheses,05_062406036_0135_1_2,ankle disarticulation prostheses,Each,Y,,N,Assistive technology,5
